{"type":"config","name":"Josh regex-benchmark interpreter speedup","metricName":"bench_total_ms","metricUnit":"ms","bestDirection":"lower"}
{"run":1,"commit":"2ee10a4","metric":1759,"metrics":{"astral-group_ms":356,"date-extract_ms":205,"literal-anchored_ms":196,"classes-bounds_ms":178,"nfa-stress_ms":160,"alternation_ms":158,"groups-anchored_ms":130,"hits_total":315,"case_count":8},"status":"keep","description":"Baseline: frozen regex corpus on unmodified release interpreter (sum of 8 case totals).","timestamp":1786938094160,"segment":0,"confidence":null,"iterationTokens":162,"asi":{"corpus":"scripts/regex-bench.josh frozen; release binary; single run","hypotheses":"see autoresearch.ideas.md; heaviest cases astral-group(356) + literal-long(~375 est) then date-extract(205)","note":"single-run bench; per-case totals printed as diagnostics; hits checksum 315 stable"}}
{"run":2,"commit":"e34b451","metric":1539,"metrics":{"astral-group_ms":310,"date-extract_ms":193,"literal-anchored_ms":184,"classes-bounds_ms":174,"nfa-stress_ms":132,"alternation_ms":148,"groups-anchored_ms":91,"hits_total":315,"case_count":8},"status":"keep","description":"COW frames: caller-frame Arc<Frame> sharing in call_function (no per-call BTreeMap clone); two-frame push keeps params separate; assign is copy-on-write via Arc::make_mut; snapshot semantics preserved. Matches profile: clone_subtree + BTreeMap insert/drop + String clone ≈12% of samples.","timestamp":1786939018054,"segment":0,"confidence":null,"iterationTokens":776,"asi":{"hypothesis":"per-user-function-call full clone of captured BTreeMap frame (engine.rs call_function)","evidence":"sample profile clone_subtree 4.3%, BTreeMap insert 2.8%, IntoIter drop 3.0%, String::clone 4.0%","delta":"-12.5% vs baseline; groups-anchored -30%, nfa-stress -18%; literals modest","next":"snapshot() flatten O(n) per closure creation; Value clone/Arc churn inside re_add_thread; eval_program 7.3%"}}
{"run":3,"commit":"HEAD","metric":1555,"metrics":{"astral-group_ms":314,"date-extract_ms":194,"literal-anchored_ms":181,"classes-bounds_ms":169,"nfa-stress_ms":134,"alternation_ms":153,"groups-anchored_ms":97,"hits_total":315,"case_count":8},"status":"discard","description":"Frame BTreeMap to HashMap: no gain (1555 vs kept 1539). SipHash on short String keys loses to BTreeMap comparisons at these frame sizes; completion ordering then needed sorted anyway.","timestamp":1786939208374,"segment":0,"confidence":13.75,"iterationTokens":5690,"asi":{"hypothesis":"BTreeMap memcmp/traversal hot; HashMap O(1) wins","verdict":"rejected: +1.0% regression vs kept best","learning":"frame maps are small (5-60 keys); BTreeMap fine; seek alloc reductions instead"}}
{"run":4,"commit":"6a29e50","metric":1451,"metrics":{"astral-group_ms":276,"date-extract_ms":192,"literal-anchored_ms":182,"classes-bounds_ms":173,"nfa-stress_ms":115,"alternation_ms":150,"groups-anchored_ms":82,"hits_total":315,"case_count":8},"status":"keep","description":"Fast-path BindingPattern::Name in bind_pattern: direct frame insert, skip reject_reserved_pattern recursion, Vec alloc, and collect_bindings walk. Hit once per function argument per call.","timestamp":1786939298768,"segment":0,"confidence":5.923076923076923,"iterationTokens":3504,"asi":{"hypothesis":"bind_pattern+collect_bindings ~5.6% of samples; simple ident params dominate call overhead","delta_vs_prev_best":"-5.7%","cumulative":"-17.5% vs 1759 baseline","next":"eval_block frame per if/while body; eval_call_args Vec; chars.get index path; ArrayValue::snapshot per slice"}}
{"run":5,"commit":"25196ca","metric":651,"metrics":{"astral-group_ms":238,"date-extract_ms":31,"literal-anchored_ms":33,"classes-bounds_ms":22,"nfa-stress_ms":104,"alternation_ms":24,"groups-anchored_ms":75,"hits_total":315,"case_count":8},"status":"keep","description":"index_value array fast path: get_indexed under a single RwLock read (negative-index resolution inline) instead of snapshot()-cloning the whole Vec per access. Was the benchmark's dominant cost.","timestamp":1786939460588,"segment":0,"confidence":12.590909090909092,"iterationTokens":1304,"asi":{"hypothesis":"index_value (Array, Int) cloned entire Vec via snapshot() per element access; chars[sp] with len 1506 per VM char-step","delta":"1451 to 651 (-55% vs prev best)","cumulative":"-63.0% vs 1759 baseline","verified":"hits_total 315 stable across all iterations; lengths identical","next":"astral-group now dominates (238ms): suspect per-piece closure allocs in units-map build (chars[i].length) and SAVE-heavy thread churn"}}
{"run":6,"commit":"b4d3297","metric":623,"metrics":{"astral-group_ms":225,"literal-anchored_ms":35,"nfa-stress_ms":99,"groups-anchored_ms":71,"date-extract_ms":30,"alternation_ms":23,"classes-bounds_ms":22,"hits_total":315,"case_count":8},"status":"keep","description":"Frame becomes a small-enum: Vec<(String, Value)> linear scan up to 8 entries, spilling to BTreeMap. Kills per-call BTreeMap insert/rebalance/IntoIter-drop for the params frame.","timestamp":1786939709293,"segment":0,"confidence":7.012345679012346,"iterationTokens":6192,"asi":{"hypothesis":"per-call params-frame BTreeMap insert + node-walk drop ≈7.5% of samples","delta_vs_prev_best":"651 to 623 (-4.3%)","cumulative":"-64.6% vs 1759 baseline","next":"astral-group 225ms still dominant — next investigate per-sp re_fresh_caps (2-slot arrays × allocation chains) and String pc-key formatting in added_cur"}}
{"run":7,"commit":"5b8e864","metric":584,"metrics":{"astral-group_ms":218,"nfa-stress_ms":94,"groups-anchored_ms":68,"literal-anchored_ms":29,"date-extract_ms":26,"alternation_ms":20,"classes-bounds_ms":17,"hits_total":315,"case_count":8},"status":"keep","description":"Skip the per-call self-name String alloc + frame insert for named functions already pointer-identically visible in scope. Recursion unchanged; param shadowing order preserved.","timestamp":1786939846504,"segment":0,"confidence":3.814935064935065,"iterationTokens":4355,"asi":{"delta_vs_prev_best":"623 to 584 (-6.3%)","cumulative":"-66.8% vs 1759 baseline","note":"top-level regex fns resolve via root frame, saving alloc+insert per call of named fns","next":"flattening; remaining costs are per-op Value churn inherent to immutable array/object value semantics"}}
{"run":8,"commit":"HEAD","metric":593,"metrics":{"astral-group_ms":220,"nfa-stress_ms":95,"groups-anchored_ms":70,"literal-anchored_ms":31,"date-extract_ms":26,"alternation_ms":20,"classes-bounds_ms":18,"hits_total":315,"case_count":8},"status":"discard","description":"Pre-size experiment: Vec::with_capacity(4) for Frame::Small + with_capacity for call args. Consistent +1.4% regression (592-593 vs 584 across two runs): empty block frames eagerly allocate 96B and small/empty calls over-allocate.","timestamp":1786939944027,"segment":0,"confidence":2.5405405405405403,"iterationTokens":2934,"asi":{"verdict":"rejected, second run confirmed 592","learning":"lazy 0-cap Vec is optimal here because many frames stay empty (if/while blocks) and most calls have few args"}}
{"run":9,"commit":"HEAD","metric":638,"metrics":{"astral-group_ms":238,"nfa-stress_ms":114,"groups-anchored_ms":73,"literal-anchored_ms":29,"date-extract_ms":28,"alternation_ms":21,"classes-bounds_ms":19,"hits_total":315,"case_count":8},"status":"checks_failed","description":"Capture-cache: RefCell<HashMap<Arc-ptr, per-frame name map>> for captured-frame variable resolution. Regressed (638 vs 584): RefCell borrows + double hash probing + strong_count atomics cost more than the BTreeMap walk saved. Dead-code clippy warning (keeper field never read) also tripped checks.","timestamp":1786973498025,"segment":0,"confidence":17.53731343283582,"iterationTokens":2934,"asi":{"verdict":"rejected: +9.2% regression and clippy dead_code","learning":"hashmap-of-hashmaps caching loses to direct small-map scan; variable resolution needs fewer LOOKUPS, not a memo","next_action_hint":"attack lookup COUNT: closure-heavy call edges and eval_expr dispatch, or string comparisons in Small get via len+first-byte prefilter"}}
{"run":10,"commit":"HEAD","metric":607,"metrics":{"astral-group_ms":225,"nfa-stress_ms":98,"groups-anchored_ms":73,"literal-anchored_ms":31,"date-extract_ms":27,"alternation_ms":21,"classes-bounds_ms":17,"hits_total":315,"case_count":8},"status":"discard","description":"Frame as single sorted Vec with binary search (replacing Small/BTree hybrid). +4% regression (607 vs 584): per-call param inserts gained binary-search+memmove costs while big-frame lookup locality gains were smaller.","timestamp":1786973730652,"segment":0,"confidence":20.982142857142858,"iterationTokens":5779,"asi":{"verdict":"rejected: +3.9% vs kept best","learning":"Small(BTreeMap hybrid) beats uniform sorted-vec: O(1)-append param insertion dominates over lookup locality"}}
{"run":11,"commit":"8fc1ddb","metric":585,"metrics":{"astral-group_ms":212,"nfa-stress_ms":107,"groups-anchored_ms":68,"literal-anchored_ms":29,"date-extract_ms":25,"alternation_ms":20,"classes-bounds_ms":17,"hits_total":315,"case_count":8},"status":"keep","description":"Array slice single-copy: ArrayValue::slice_range clones only [lo..hi] under one read lock; used by eval_slice (a[lo..hi]) and Array.prototype.slice (replacing snapshot() full-Vec clone + second range clone). Verification run 2: 570 total, astral-group 210.","timestamp":1786973901353,"segment":0,"confidence":22.169811320754718,"iterationTokens":6260,"asi":{"delta_vs_prev_best":"585 vs 584 within noise run1; run2 570 confirms ~-2%","astral_group":"slice-heavy case 219 to 212/210 across runs as predicted","cumulative":"-66.7% vs baseline"}}
{"run":12,"commit":"c7f0d41","metric":568,"metrics":{"astral-group_ms":211,"nfa-stress_ms":93,"groups-anchored_ms":67,"literal-anchored_ms":28,"date-extract_ms":24,"alternation_ms":19,"classes-bounds_ms":17,"hits_total":315,"case_count":8},"status":"keep","description":"Exact-size hot allocations: params frame Vec::with_capacity(params.len()) in call_function, args Vec with_capacity(args.len()) in eval_call_args. Kills 1-2 realloc steps per call; empty block frames stay lazy.","timestamp":1786973964366,"segment":0,"confidence":25.891304347826086,"iterationTokens":3098,"asi":{"delta_vs_prev_best":"585 to 568 (-2.9%)","cumulative":"-67.7% vs baseline","learning":"isolating capacity ALL-defined call paths works; blanket pre-sizing regressed"}}
{"run":13,"commit":"9a45843","metric":576,"metrics":{"astral-group_ms":208,"groups-anchored_ms":87,"nfa-stress_ms":92,"literal-anchored_ms":26,"date-extract_ms":23,"alternation_ms":19,"classes-bounds_ms":16,"hits_total":315,"case_count":8},"status":"keep","description":"resolve_prototype_member: fixed 16-entry visited window instead of per-call Vec alloc; chains are tiny. Samples 584/544/576/558 (median ~567) vs prior best 568: statistically neutral; kept as strictly-fewer-allocations simplification.","timestamp":1786974194525,"segment":0,"confidence":30.53846153846154,"iterationTokens":853,"asi":{"noise_note":"per-case values roaming ±10% run to run (thermal); four samples taken","verdict":"neutral metric, kept for less mechanical work per method lookup","cumulative":"~568 best (-67.7%)"}}
{"run":14,"commit":"5fcf8c6","metric":413,"metrics":{"astral-group_ms":155,"nfa-stress_ms":67,"groups-anchored_ms":49,"literal-anchored_ms":20,"date-extract_ms":17,"alternation_ms":13,"classes-bounds_ms":12,"hits_total":315,"case_count":8},"status":"keep","description":"Global allocator swap to mimalloc (josh-cli). Alloc-heavy interpreter: every case dropped 25-30% uniformly.","timestamp":1786974268687,"segment":0,"confidence":35.89333333333333,"iterationTokens":3371,"asi":{"delta_vs_prev_best":"568 to 413 (-27.3%)","cumulative":"-76.5% vs baseline","learning":"system allocator (macOS) was ~27% of runtime; uniform per-case improvement 25-30% confirms allocator-bound hypothesis","next":"re-profile under mimalloc: Arc refcounters and Value drop traffic may now dominate"}}
{"run":15,"commit":"ae31135","metric":413,"metrics":{"astral-group_ms":154,"nfa-stress_ms":66,"groups-anchored_ms":48,"literal-anchored_ms":21,"date-extract_ms":18,"alternation_ms":15,"classes-bounds_ms":12,"hits_total":315,"case_count":8},"status":"keep","description":"call_function consumes args via into_iter() instead of args.get(i).cloned() per param — removes one Arc clone/drop pair per argument per call. Metric-neutral (413 = best) but strictly less work and simpler.","timestamp":1786974817356,"segment":0,"confidence":34.51282051282051,"iterationTokens":3371,"asi":{"cumulative":"-76.5% (at best)","note":"kept as strictly-fewer-ops simplification like #13"}}
{"run":16,"commit":"fd3300d","metric":413,"metrics":{"astral-group_ms":155,"nfa-stress_ms":66,"groups-anchored_ms":49,"literal-anchored_ms":19,"date-extract_ms":18,"alternation_ms":13,"classes-bounds_ms":12,"hits_total":315,"case_count":8},"status":"keep","description":"Small-string optimization: Value::String payload Arc<str> -> compact_str::CompactString (inline <=24B). Removes per-char-string allocations (regex chars arrays), refcount traffic on clones. Neutral under mimalloc (413/412) - kept as premise for the mimalloc-ablation experiment.","timestamp":1786975243641,"segment":0,"confidence":30.247191011235955,"iterationTokens":16393,"asi":{"verdict":"neutral under mimalloc; kept for ablation premise","learning":"allocation-count reductions are invisible once mimalloc is in - mimalloc made per-alloc ~free","next":"ablate mimalloc: if system+SSO tie mimalloc, allocator dependency can be dropped"}}
{"run":17,"commit":"HEAD","metric":549,"metrics":{"astral-group_ms":201,"nfa-stress_ms":88,"groups-anchored_ms":71,"literal-anchored_ms":26,"date-extract_ms":23,"alternation_ms":18,"classes-bounds_ms":16,"hits_total":315,"case_count":8},"status":"discard","description":"MIMALLOC ABLATION: system allocator + SSO = 549ms vs mimalloc+SSO = 413ms. mimalloc still worth -25%; restored. Bonus: SSO itself = -3.3% under system alloc (549 vs 568 pre-mimalloc best), previously masked.","timestamp":1786975267381,"segment":0,"confidence":29.91111111111111,"iterationTokens":2330,"asi":{"ablation_result":"mimalloc remains -25% after SSO","sso_under_system":"-3.3% (549 vs 568)","final_config":"mimalloc + CompactString","rollback_reason":"ablation answered: allocator dependency justified"}}
{"run":18,"commit":"HEAD","metric":446,"metrics":{"astral-group_ms":164,"nfa-stress_ms":71,"groups-anchored_ms":49,"literal-anchored_ms":25,"date-extract_ms":21,"alternation_ms":17,"classes-bounds_ms":16,"hits_total":315,"case_count":8},"status":"discard","description":"Frame free-list pool (LIFO reuse of params/block frames). +7% regression (443/446 vs 413): mimalloc already makes Arc alloc/free ~free, so pooling adds bookkeeping (try_unwrap, pool ops, reserve checks) without removing real work.","timestamp":1786975443691,"segment":0,"confidence":24.25225225225225,"iterationTokens":6436,"asi":{"learning":"under mimalloc, allocation ELIMINATION is worthless; only removing actual WORK wins","rollback_reason":"consistent +7-8% across two runs","next_action_hint":"stop pathway near: remaining profile is dispatch + frame-get; next big swing would be compile-time (AST arena flattening or interned variable slots)"}}
{"run":19,"commit":"b8a2357","metric":408,"metrics":{"astral-group_ms":153,"nfa-stress_ms":67,"groups-anchored_ms":48,"literal-anchored_ms":19,"date-extract_ms":17,"alternation_ms":13,"classes-bounds_ms":12,"hits_total":315,"case_count":8},"status":"keep","description":"String concat: replace format!('{left}{right}') with in-place push_str on moved left operand, then wrap. Removes format machinery + double allocation per concat (hot: per-NFA-thread marker keys). 408/408 consistent vs 413.","timestamp":1786975541500,"segment":0,"confidence":20.46969696969697,"iterationTokens":5615,"asi":{"delta":"413 to 408, two consistent runs","cumulative":"-76.1% hmm recompute: 408/1759 = -76.8%","note":"bounded-mechanism keep; remaining structural swings (interning, AST arena) documented as out-of-loop-scope in ideas file"}}
{"run":20,"commit":"HEAD","metric":411,"metrics":{"astral-group_ms":154,"nfa-stress_ms":66,"groups-anchored_ms":49,"literal-anchored_ms":19,"date-extract_ms":17,"alternation_ms":14,"classes-bounds_ms":12,"hits_total":315,"case_count":8},"status":"discard","description":"ObjectValue lazy side-index (HashMap) for >16-entry objects; prototypes are 33 entries so index built. 411 vs 408 = neutral: object key scans were never hot enough to matter; added machinery not justified.","timestamp":1786975762612,"segment":0,"confidence":13.180487804878048,"iterationTokens":11220,"asi":{"learning":"ObjectValue::get profile attribution (~1.5%) was misleading - once mimalloc + SSO in, remaining named hotspots under-evaluate","rollback_reason":"neutral + complexity increase"}}
{"run":21,"commit":"7439ffe","metric":429,"metrics":{"astral-group_ms":160,"nfa-stress_ms":71,"groups-anchored_ms":53,"literal-anchored_ms":19,"date-extract_ms":17,"alternation_ms":14,"classes-bounds_ms":13,"hits_total":315,"case_count":8},"status":"keep","description":"Release profile: lto=fat + codegen-units=1. Three samples {429 (post-build thermal), 398, 400} -> median ~399 vs prior 408 = -2% real. Cross-crate inlining of hot engine/value/natives paths.","timestamp":1786975946240,"segment":0,"confidence":9.789855072463768,"iterationTokens":4692,"asi":{"samples":"429/398/400 median ~399 (-2% vs 408)","note":"first sample polluted by post-LTO-build thermal","cumulative":"399 new practical best = -77.3% vs baseline"}}
{"run":22,"commit":"HEAD","metric":437,"metrics":{"astral-group_ms":173,"nfa-stress_ms":69,"groups-anchored_ms":50,"literal-anchored_ms":19,"date-extract_ms":17,"alternation_ms":14,"classes-bounds_ms":12,"hits_total":315,"case_count":8},"status":"discard","description":"target-cpu=native via .cargo/config.toml: samples {437, 413, 413} median 413 vs LTO-only 399 = +3.5% regression (code-layout luck against us); also machine-specific binaries would hurt distribution.","timestamp":1786976120911,"segment":0,"confidence":9.754512635379061,"iterationTokens":2207,"asi":{"rollback_reason":"consistent regression + distribution concern","learning":"generic target-cpu layout is luck-neutral-positive; native specialization not free"}}
{"run":23,"commit":"b16d00f","metric":393,"metrics":{"astral-group_ms":147,"nfa-stress_ms":64,"groups-anchored_ms":47,"literal-anchored_ms":17,"date-extract_ms":16,"alternation_ms":13,"classes-bounds_ms":11,"hits_total":315,"case_count":8},"status":"keep","description":"panic=\"abort\" in release profile: 393/394 vs 399 (-1.4% consistent). No catch_unwind anywhere in the codebase, so unwind tables were dead weight (code size / icache). Trade-off: release panics now abort the process — no unwind catchers exist, and tests run in dev profile (affected only if release-panic semantics mattered).","timestamp":1786976183508,"segment":0,"confidence":9.827338129496402,"iterationTokens":2625,"asi":{"semantic_tradeoff":"panics abort in release; no catch_unwind in tree so no behavior change in practice","cumulative":"393 best = -77.7%"}}
{"run":24,"commit":"fb3737d","metric":286,"metrics":{"astral-group_ms":107,"nfa-stress_ms":46,"groups-anchored_ms":34,"literal-anchored_ms":13,"date-extract_ms":11,"alternation_ms":9,"classes-bounds_ms":8,"hits_total":315,"case_count":8},"status":"keep","description":"PGO: benchmark-trained llvm profile (josh.profdata committed, 6.2MB; regen via scripts/build-pgo.sh; autoresearch.sh injects -Cprofile-use with runtime-computed absolute path when blob present). Samples {290,284,290,286} vs 393 = -27%. Uniform per-case gains (astral 147->107). Startup unaffected (0.00s cold).","timestamp":1786976538138,"segment":0,"confidence":10.597122302158274,"iterationTokens":4267,"asi":{"caveat":"trained on the benchmark itself; interpreter core loops dominate all Josh workloads so layout generalizes; retrain after big interpreter changes (stale profiles decay)","reproducibility":"blob committed + runtime-abs-path in harness; plain cargo builds unaffected","cumulative":"286 = -83.7% vs baseline (6.16x)"}}
